{
  "case_id": "SCJ-1837",
  "title": "Mohd. Usman v. Dakkshinachal Vidyut Vitran Nigam Ltd.",
  "neutral_citation": "",
  "court": "High Court of Judicature at Allahabad",
  "bench": "Division Bench",
  "coram": "Shashi Kant Gupta, J. and Ajit Kumar, J.",
  "date_of_judgment": "2018-09-18",
  "date_display": "18 September 2018",
  "docket": "Writ-C No. 31060 of 2018",
  "page_count": 3,
  "significance": "significant",
  "outcome": "licensee",
  "model": "Grok 4.6",
  "disposition": "Writ dismissed; theft disconnection under clause 8.1(viii) upheld.",
  "headnote": "On an alleged theft inspection, with an FIR under section 135 of the Electricity Act, 2003, clause 8.1(viii) of the Electricity Supply Code, 2005 authorised the licensee to disconnect supply forthwith on the spot. A later disconnection, after a crowd had prevented on-spot disconnection, was held prima facie justified. The writ seeking restoration and quashing of the disconnection and provisional assessment was dismissed; grievances against the assessment were left to the assessing authority for a speaking order.",
  "facts": "On inspection the petitioner's flour mill at Mathura was allegedly found committing theft of electricity. An FIR dated 14 August 2018 was lodged under section 135 of the Electricity Act, 2003. A crowd prevented on-the-spot disconnection; supply was cut on 28 August 2018 and a provisional assessment dated 16 August 2018 issued. The petitioner sought quashing of both orders and restoration, alleging disconnection without hearing. The licensee stated that he had been noticed to appear before the assessing authority on 28 September 2018.",
  "reusable_constructions": [
    {
      "construction": "Clause 8.1(viii) of the Electricity Supply Code, 2005 empowers the licensee to disconnect electricity supply forthwith on the spot where the consumer is found committing theft of electricity.",
      "paras": "1"
    },
    {
      "construction": "Where a crowd prevents on-spot disconnection at the time of a theft inspection, a later disconnection of the same supply remains prima facie justified under clause 8.1(viii); a writ will not restore supply or quash the disconnection on the ground that no pre-disconnection hearing was given.",
      "paras": "1"
    }
  ],
  "holding_units": [
    {
      "provision": "UP-2005::8.1",
      "code": "UP-2005",
      "clause": "8.1(viii)",
      "topic": "theft-disconnection",
      "type": "supply_code",
      "holding": "Clause 8.1(viii) of the Electricity Supply Code, 2005 empowers the licensee to disconnect supply forthwith on the spot where the consumer is found committing theft of electricity. After an inspection allegedly disclosing theft and an FIR under section 135 of the Electricity Act, 2003, disconnection on 28 August 2018 was prima facie justified even though a crowd had prevented immediate disconnection. The writ to quash that disconnection and the provisional assessment and to restore supply was dismissed; the consumer was left to raise all grievances before the assessing authority, which was to pass a speaking order.",
      "paras": "1"
    }
  ],
  "principle_tags": [
    {
      "tag": "s135-arrest-safeguards-and-compounding-remedy",
      "application": "On an alleged theft inspection, with an FIR under section 135 of the Electricity Act, 2003, clause 8.1(viii) of the Electricity Supply Code, 2005 authorised the licensee to disconnect supply forthwith on the spot. A later disconnection, after a crowd had prevented on-spot disconnection, was held prima facie justified..",
      "lead_authorities": [],
      "paras": "1"
    },
    {
      "tag": "opportunity-before-final-assessment",
      "application": "On an alleged theft inspection, with an FIR under section 135 of the Electricity Act, 2003, clause 8.1(viii) of the Electricity Supply Code, 2005 authorised the licensee to disconnect supply forthwith on the spot. A later disconnection, after a crowd had prevented on-spot disconnection, was held prima facie justified..",
      "lead_authorities": [],
      "paras": "1"
    }
  ],
  "not_decided": [
    {
      "point": "Whether the petitioner in fact committed theft of electricity",
      "note": "The Court proceeded on the alleged inspection finding and a prima facie justification for disconnection; it did not try the theft charge.",
      "paras": "1"
    },
    {
      "point": "Validity of the provisional assessment dated 16 August 2018",
      "note": "Left to the assessing authority, which was to hear the petitioner on 28 September 2018 and pass a speaking order.",
      "paras": "1"
    }
  ],
  "authorities": []
}
