{
  "case_id": "SCJ-3444",
  "title": "Rakesh Dhar Bind v. State of U.P.",
  "neutral_citation": "",
  "court": "High Court of Judicature at Allahabad",
  "bench": "Division Bench",
  "coram": "Manoj Kumar Gupta, J. and Prashant Kumar, J.",
  "date_of_judgment": "2023-05-01",
  "date_display": "1 May 2023",
  "docket": "WRIT-C No. 14687 of 2023",
  "page_count": 1,
  "significance": "significant",
  "outcome": "consumer",
  "model": "Grok 4.6",
  "disposition": "Demand notice quashed; hearing then final assessment under Supply Code",
  "headnote": "A notice that grants thirty days to object to a proposed assessment is not a final assessment. The demand issued without deciding the objection already filed is quashed, and the licensee must hear the consumer and then pass a final assessment under the Electricity Supply Code, 2005.",
  "facts": "Rakesh Dhar Bind challenged demand notices of 18 January 2023 and 14 March 2023 seeking Rs.18,170 for an electricity connection taken by his late father. The January notice gave thirty days, as a last opportunity, to object to a proposed assessment of Rs.20,170 and a compounding fee of Rs.18,170, failing which a final assessment would be made. He filed an objection by registered post on 27 February 2023. Without deciding it, the department issued the March demand.",
  "reusable_constructions": [
    {
      "construction": "A notice that itself grants time to object to a proposed assessment is only a provisional assessment and cannot be treated as an order of final assessment.",
      "paras": "1"
    },
    {
      "construction": "A demand raised without deciding an objection already filed to the provisional assessment is liable to be quashed, with a direction to hear the consumer and then pass final assessment under the Electricity Supply Code, 2005.",
      "paras": "1"
    }
  ],
  "holding_units": [
    {
      "provision": "UP-2005::final-assessment",
      "code": "UP-2005",
      "clause": "final assessment",
      "topic": "provisional notice inviting objection is not a final assessment",
      "type": "supply_code",
      "holding": "The notice dated 18.01.2023 is not an order of final assessment, because it grants thirty days as a last opportunity to file an objection against the provisional assessment. The demand notice dated 14.03.2023, issued without deciding the objection filed on 27.02.2023, is quashed. The department must hear the petitioner and thereafter pass a final assessment strictly in accordance with the procedure prescribed under the Electricity Supply Code, 2005.",
      "paras": "1",
      "flag": "Order cites the Electricity Supply Code, 2005 for the final-assessment procedure but states no clause number."
    }
  ],
  "principle_tags": [
    {
      "tag": "provisional-assessment-notice-is-not-final-assessment",
      "application": "The 18 January 2023 notice, which gave thirty days to object to the proposed assessment and compounding fee, was held not to be a final assessment. The 14 March 2023 demand, issued without deciding the objection, was quashed and the matter sent back for a hearing and a final assessment under the Supply Code.",
      "lead_authorities": [],
      "paras": "1"
    }
  ],
  "not_decided": [
    {
      "point": "Quantum of the proposed assessment and compounding fee, and the petitioner's liability for his late father's connection",
      "note": "Left to a hearing and a final assessment under the Electricity Supply Code, 2005.",
      "paras": "1"
    }
  ],
  "authorities": []
}
