{
  "case_id": "SCJ-401",
  "title": "Guddi Kesarwani v. State of U.P.",
  "neutral_citation": "2025:AHC:20157-DB",
  "court": "High Court of Judicature at Allahabad",
  "bench": "Division Bench",
  "coram": "Shekhar B. Saraf, J.; Vipin Chandra Dixit, J.",
  "date_of_judgment": "2025-02-11",
  "date_display": "11 February 2025",
  "docket": "Writ - C No. 226 of 2025",
  "page_count": 3,
  "significance": "significant",
  "outcome": "consumer",
  "disposition": "Writ disposed of; rejection quashed; connection directed within eight weeks.",
  "headnote": "An occupier of premises, even a trespasser, is entitled to a domestic electricity connection as a fundamental right under Article 21. Rejection of a clause 4.4 application solely for want of ownership proof, despite domicile, gas passbook and ration card showing residence, is unsustainable. The Executive Engineer's order dated 26 July 2024 is quashed and the licensee is directed to grant the connection within eight weeks upon statutory payment.",
  "facts": "The petitioner, occupying a house and claiming a one-seventh share in partition suit O.S. No. 11 of 2022, sought a domestic electricity connection. The CGRF, Prayagraj, had directed her to apply afresh. A coordinate Bench on 21 June 2024 left her to apply under clause 4.4(a) of the U.P. Electricity Supply Code, 2005. The Executive Engineer, Rambagh Division, Prayagraj, then rejected the application on 26 July 2024 for want of ownership proof, treating her domicile certificate, gas passbook, ration card and plaint as insufficient.",
  "reusable_constructions": [
    {
      "construction": "An occupier of premises, even a trespasser, is entitled to a domestic electricity connection as a fundamental right under Article 21.",
      "paras": "5-6"
    },
    {
      "construction": "Rejection of a Clause 4.4 application solely for want of ownership proof is unsustainable where domicile, gas passbook and ration card show residence.",
      "paras": "5-6"
    }
  ],
  "holding_units": [
    {
      "provision": "UP-2005::4.4",
      "code": "UP-2005",
      "clause": "4.4",
      "topic": "occupancy proof for new connection",
      "type": "supply_code",
      "holding": "Rejection of a new domestic connection solely for want of ownership proof is unsustainable. An occupier, even a trespasser, is entitled to electricity as a fundamental right under Article 21; domicile certificate, gas passbook and ration card showing residence suffice. The 26 July 2024 rejection is quashed and the licensee is directed to grant the connection within eight weeks upon statutory payment.",
      "paras": "5-6"
    }
  ],
  "principle_tags": [
    {
      "tag": "clause-7.10-forum-ombudsman-route-for-billing-grievances",
      "application": "An occupier of premises, even a trespasser, is entitled to a domestic electricity connection as a fundamental right under Article 21. Rejection of a clause 4.4 application solely for want of ownership proof, despite domicile, gas passbook and ration card showing residence, is unsustainable..",
      "lead_authorities": [],
      "paras": "5-6"
    },
    {
      "tag": "clause-4.4-occupant-connection-on-indemnity-bond",
      "application": "An occupier of premises, even a trespasser, is entitled to a domestic electricity connection as a fundamental right under Article 21. Rejection of a clause 4.4 application solely for want of ownership proof, despite domicile, gas passbook and ration card showing residence, is unsustainable..",
      "lead_authorities": [],
      "paras": "5-6"
    }
  ],
  "not_decided": [],
  "authorities": []
}
