{
  "case_id": "SCJ-619",
  "title": "Ram Prasad Gupta v. State of U.P.",
  "neutral_citation": "2024:AHC:157855-DB",
  "court": "Allahabad High Court",
  "bench": "Division Bench",
  "coram": "Manoj Kumar Gupta and Kshitij Shailendra, JJ.",
  "date_of_judgment": "2024-09-26",
  "date_display": "26 September 2024",
  "docket": "WRIT - C No. 28041 of 2024",
  "page_count": 4,
  "significance": "significant",
  "outcome": "consumer",
  "model": "Grok 4.6",
  "disposition": "Assessment withdrawn as unsustainable; writ disposed with liberty to redo.",
  "headnote": "A final assessment passed without any independent finding on theft or unauthorized use of electricity is contrary to Paragraph 6.8 of the U.P. Electricity Supply Code, 2005. After the Chief Engineer admitted the 19 July 2024 assessment was unsustainable and withdrew it, the Division Bench disposed of the writ with liberty to pass a fresh order strictly in accordance with law.",
  "facts": "Ram Prasad Gupta challenged a final assessment dated 19 July 2024 of the Executive Engineer, Vidhut Vitran Khand, Ghazipur. On 12 September 2024 the Court stayed recovery and directed the Chief Engineer to examine the facts, noting a similar order by the same officer in another writ. The Chief Engineer later admitted by personal affidavit that the order was unsustainable and had been withdrawn, with a fresh notice issued for objections. Show-cause notices had also issued to the Superintending and Executive Engineers for lapses in monitoring and procedure.",
  "reusable_constructions": [
    {
      "construction": "Paragraph 6.8 of the U.P. Electricity Supply Code, 2005 requires the assessing officer to record an independent finding on theft or unauthorized use of electricity; a final assessment lacking such findings cannot stand.",
      "paras": "2"
    }
  ],
  "holding_units": [
    {
      "provision": "UP-2005::6.8",
      "code": "UP-2005",
      "clause": "6.8",
      "topic": "independent findings on theft or UUE in final assessment",
      "type": "supply_code",
      "holding": "Paragraph 6.8 of the U.P. Electricity Supply Code, 2005 requires the assessing officer to record an independent finding relating to theft or unauthorized use of electricity; a final assessment lacking such findings is contrary to that paragraph and cannot stand.",
      "paras": "2",
      "flag": "Paragraph 6.8 applied to theft or UUE without distinguishing Clause 8 theft assessment."
    }
  ],
  "principle_tags": [
    {
      "tag": "opportunity-before-final-assessment",
      "application": "A final assessment passed without any independent finding on theft or unauthorized use of electricity is contrary to Paragraph 6.8 of the U.P. Electricity Supply Code, 2005..",
      "lead_authorities": [],
      "paras": "2"
    }
  ],
  "not_decided": [
    {
      "point": "Merits of theft or unauthorized use and any fresh assessment",
      "note": "The 19 July 2024 assessment was withdrawn as unsustainable; respondents were given liberty to pass a fresh order strictly in accordance with law.",
      "paras": "3-5"
    }
  ],
  "authorities": []
}
